{
  "$schema": "https://json-schema.org/draft/2020-12/schema",
  "$id": "https://natnaelalemseged.com/schemas/resume.schema.json",
  "title": "Portfolio Resume",
  "type": "object",
  "additionalProperties": false,
  "required": [
    "metadata",
    "person",
    "profile",
    "proof",
    "experience",
    "independentDelivery",
    "skills",
    "publications",
    "certifications",
    "education"
  ],
  "properties": {
    "$schema": {
      "type": "string"
    },
    "metadata": {
      "type": "object",
      "additionalProperties": false,
      "required": ["title", "subject"],
      "properties": {
        "title": {
          "type": "string",
          "minLength": 1
        },
        "subject": {
          "type": "string",
          "minLength": 1
        }
      }
    },
    "person": {
      "type": "object",
      "additionalProperties": false,
      "required": [
        "name",
        "headline",
        "location",
        "phone",
        "email",
        "links"
      ],
      "properties": {
        "name": {
          "type": "string",
          "minLength": 1
        },
        "headline": {
          "type": "string",
          "minLength": 1
        },
        "location": {
          "type": "string",
          "minLength": 1
        },
        "phone": {
          "type": "string",
          "minLength": 1
        },
        "email": {
          "type": "string",
          "format": "email"
        },
        "links": {
          "type": "array",
          "minItems": 1,
          "items": {
            "$ref": "#/$defs/link"
          }
        }
      }
    },
    "profile": {
      "type": "string",
      "minLength": 1
    },
    "proof": {
      "type": "object",
      "additionalProperties": false,
      "required": ["label", "url", "facts"],
      "properties": {
        "label": {
          "type": "string",
          "minLength": 1
        },
        "url": {
          "type": "string",
          "format": "uri"
        },
        "facts": {
          "type": "array",
          "minItems": 1,
          "items": {
            "type": "string",
            "minLength": 1
          }
        }
      }
    },
    "experience": {
      "type": "object",
      "additionalProperties": false,
      "required": ["primary", "earlier"],
      "properties": {
        "primary": {
          "type": "array",
          "minItems": 1,
          "items": {
            "$ref": "#/$defs/role"
          }
        },
        "earlier": {
          "type": "array",
          "items": {
            "$ref": "#/$defs/role"
          }
        }
      }
    },
    "independentDelivery": {
      "type": "array",
      "items": {
        "type": "object",
        "additionalProperties": false,
        "required": ["name", "description"],
        "properties": {
          "name": {
            "type": "string",
            "minLength": 1
          },
          "description": {
            "type": "string",
            "minLength": 1
          },
          "url": {
            "type": "string",
            "format": "uri"
          }
        }
      }
    },
    "skills": {
      "type": "array",
      "minItems": 1,
      "items": {
        "type": "object",
        "additionalProperties": false,
        "required": ["group", "items"],
        "properties": {
          "group": {
            "type": "string",
            "minLength": 1
          },
          "items": {
            "type": "string",
            "minLength": 1
          }
        }
      }
    },
    "publications": {
      "type": "array",
      "items": {
        "type": "object",
        "additionalProperties": false,
        "required": ["title", "outlet", "date", "url"],
        "properties": {
          "title": {
            "type": "string",
            "minLength": 1
          },
          "outlet": {
            "type": "string",
            "minLength": 1
          },
          "date": {
            "type": "string",
            "minLength": 1
          },
          "url": {
            "type": "string",
            "format": "uri"
          }
        }
      }
    },
    "certifications": {
      "type": "array",
      "items": {
        "$ref": "#/$defs/credential"
      }
    },
    "education": {
      "type": "array",
      "minItems": 1,
      "items": {
        "type": "object",
        "additionalProperties": false,
        "required": ["degree", "institution", "dates", "details"],
        "properties": {
          "degree": {
            "type": "string",
            "minLength": 1
          },
          "institution": {
            "type": "string",
            "minLength": 1
          },
          "dates": {
            "type": "string",
            "minLength": 1
          },
          "details": {
            "type": "string"
          }
        }
      }
    }
  },
  "$defs": {
    "link": {
      "type": "object",
      "additionalProperties": false,
      "required": ["label", "url"],
      "properties": {
        "label": {
          "type": "string",
          "minLength": 1
        },
        "url": {
          "type": "string",
          "format": "uri"
        }
      }
    },
    "role": {
      "type": "object",
      "additionalProperties": false,
      "required": ["title", "company", "dates", "location", "bullets"],
      "properties": {
        "title": {
          "type": "string",
          "minLength": 1
        },
        "company": {
          "type": "string",
          "minLength": 1
        },
        "dates": {
          "type": "string",
          "minLength": 1
        },
        "location": {
          "type": "string",
          "minLength": 1
        },
        "bullets": {
          "type": "array",
          "minItems": 1,
          "items": {
            "type": "string",
            "minLength": 1
          }
        }
      }
    },
    "credential": {
      "type": "object",
      "additionalProperties": false,
      "required": ["name", "issuer", "dates"],
      "properties": {
        "name": {
          "type": "string",
          "minLength": 1
        },
        "issuer": {
          "type": "string",
          "minLength": 1
        },
        "dates": {
          "type": "string",
          "minLength": 1
        },
        "url": {
          "type": "string",
          "format": "uri"
        }
      }
    }
  }
}
