{
  "$schema": "./resume.schema.json",
  "metadata": {
    "title": "Natnael Alemseged Astaw - Resume",
    "subject": "Applied AI Engineer resume"
  },
  "person": {
    "name": "Natnael Alemseged Astaw",
    "headline": "Applied AI Engineer | Agent Systems, Evaluation & Production AI",
    "location": "Addis Ababa, Ethiopia",
    "phone": "+251 961 261 683",
    "email": "natiaabaydam@gmail.com",
    "links": [
      {
        "label": "Portfolio",
        "url": "https://natnaelalemseged.com"
      },
      {
        "label": "LinkedIn",
        "url": "https://www.linkedin.com/in/natnael-alemseged"
      },
      {
        "label": "GitHub",
        "url": "https://github.com/Natnael-Alemseged"
      },
      {
        "label": "Upwork",
        "url": "https://www.upwork.com/freelancers/~01284b1ed914761198"
      }
    ]
  },
  "profile": "Software engineer with 4+ years of experience shipping production AI, web, and mobile products. Builds agentic systems, RAG, evaluation and fine-tuning pipelines, LLM-powered APIs, and polished cross-platform applications using Python, TypeScript, Flutter, and AWS. Experienced in taking ambiguous product requirements from discovery through deployment, observability, and iteration.",
  "proof": {
    "label": "Upwork Top Rated",
    "url": "https://www.upwork.com/freelancers/~01284b1ed914761198",
    "facts": [
      "100% Job Success",
      "Verified 5-star client outcomes"
    ]
  },
  "experience": {
    "primary": [
      {
        "title": "Senior Software Engineer",
        "company": "Hire Armada",
        "dates": "Jul 2025 - Present",
        "location": "United States (Remote)",
        "bullets": [
          "Engineer AI-driven backends and product features with Node.js, FastAPI, Next.js, Flutter, Prisma, LangGraph, MCP, Composio, and vector memory.",
          "Built a social discovery platform backend supporting 10K+ daily active users, real-time matching and messaging, and 99.9% uptime.",
          "Shipped a personalized affirmation product with Gemini chat, home-screen widgets, and adaptive feeds, increasing retention by 35%.",
          "Delivered an agentic collaboration workspace with real-time events, email automation, semantic search, and tagged agents, improving team productivity by 20%."
        ]
      },
      {
        "title": "Senior Full-Stack Developer",
        "company": "Startup Agile",
        "dates": "Jan 2025 - May 2026",
        "location": "United States (Remote)",
        "bullets": [
          "Led Next.js, React, React Native, and Expo delivery across web and mobile products; completed milestones 15% ahead of schedule.",
          "Implemented OTA updates, deep linking, Firebase notifications, Google Maps, AI assistants, and product analytics while reducing mobile load time by 35%.",
          "Improved Next.js rendering, SEO, and Core Web Vitals, contributing to 50%+ web traffic growth and a 30% performance improvement.",
          "Standardized TypeScript, tRPC, Prisma, Playwright, and Detox workflows, reducing production defects by 65%."
        ]
      },
      {
        "title": "AI Engineer",
        "company": "DataCore Software",
        "dates": "Jan 2025 - Aug 2025",
        "location": "United States (Remote, Contract)",
        "bullets": [
          "Built FastAPI services for real-time detection, recognition, transcription, summarization, and translation using self-hosted LLMs.",
          "Deployed containerized inference workloads to AWS EKS with sub-200 ms inference and 99.9% uptime at peak load.",
          "Fine-tuned open models and optimized GPU inference with TensorRT and ECR images, reducing cost by 12%; automated delivery with Terraform and GitHub Actions."
        ]
      },
      {
        "title": "Senior Mobile Developer",
        "company": "Qemer Software Technology PLC",
        "dates": "Aug 2024 - Sep 2025",
        "location": "Addis Ababa, Ethiopia (On-site)",
        "bullets": [
          "Led delivery of 10+ Flutter and Ionic applications, accelerating release cycles by 40%.",
          "Improved application architecture and runtime performance, cutting load times by up to 50%.",
          "Mentored junior engineers and established reusable delivery patterns, reducing onboarding time by 30%."
        ]
      }
    ],
    "earlier": [
      {
        "title": "ERP Functional Consultant",
        "company": "Red Cloud ICT Solutions",
        "dates": "Mar 2023 - Sep 2024",
        "location": "Addis Ababa, Ethiopia",
        "bullets": [
          "Progressed from Junior Consultant to Functional Consultant Assistant, supporting ERP discovery, configuration, testing, user enablement, and implementation delivery."
        ]
      },
      {
        "title": "Freelance Web Developer",
        "company": "Independent",
        "dates": "Aug 2022 - Mar 2023",
        "location": "Remote",
        "bullets": [
          "Designed, built, and delivered responsive web solutions directly with clients from requirements through launch."
        ]
      }
    ]
  },
  "independentDelivery": [
    {
      "name": "Social Music Party Game",
      "description": "Delivered a complete client product engagement from Jan-Jun 2026; received a verified 5.0 Upwork rating."
    },
    {
      "name": "AI Chatbot Engineering",
      "description": "Completed a focused AI chatbot engagement in Jan 2026; received a verified 5.0 Upwork rating."
    },
    {
      "name": "Flutter Inventory Tracker",
      "description": "Shipped and supported a cross-platform inventory application in 2025; received a verified 5.0 Upwork rating."
    }
  ],
  "skills": [
    {
      "group": "AI & Agents",
      "items": "LangGraph, RAG, agent orchestration, LLM-as-a-judge, statistical evaluation, fine-tuning, LoRA, DPO/SimPO, structured generation, zero-shot prompting, MCP, vector databases"
    },
    {
      "group": "ML Experimentation",
      "items": "Jupyter Notebook, Google Colab, reproducible experiments, benchmark design, error analysis, sampling and calibration analysis"
    },
    {
      "group": "Backend & Data",
      "items": "Python, FastAPI, Node.js, Express.js, TypeScript, PostgreSQL, MongoDB, Redis, Supabase, Firebase, Prisma, GraphQL, REST APIs, Socket.io"
    },
    {
      "group": "Web & Mobile",
      "items": "Next.js, React, React Native, Expo, Flutter, Dart, Ionic, Redux Toolkit, TanStack Query, BLoC"
    },
    {
      "group": "Cloud & Delivery",
      "items": "AWS, Docker, Kubernetes/EKS, Terraform, GitHub Actions, Prometheus, Grafana, CI/CD, microservices, n8n"
    }
  ],
  "publications": [
    {
      "title": "When Generic Benchmarks Fail: Building a Sales-Domain Evaluation Bench from Scratch",
      "outlet": "DEV Community",
      "date": "May 2026",
      "url": "https://dev.to/natnael_alemseged/when-generic-benchmarks-fail-building-a-sales-domain-evaluation-bench-from-scratch-1kjf"
    },
    {
      "title": "Why Pairing Your Bootstrap Is Necessary, And When It Stops Helping",
      "outlet": "DEV Community",
      "date": "May 2026",
      "url": "https://dev.to/natnael_alemseged/why-pairing-your-bootstrap-is-necessary-and-when-it-stops-helping-2iim"
    }
  ],
  "certifications": [
    {
      "name": "AI Agent Engineering, AI Evaluation & Forward-Deployed Engineering",
      "issuer": "10 Academy",
      "dates": "Issued May 2026"
    },
    {
      "name": "AWS Certified Solutions Architect - Associate",
      "issuer": "AWS",
      "dates": "Feb 2024 - Feb 2027",
      "url": "https://www.credly.com/badges/c7124dca-2df4-4c93-abc9-b1c0027d99b4/linked_in_profile"
    },
    {
      "name": "AWS Certified Cloud Practitioner",
      "issuer": "AWS",
      "dates": "Oct 2023 - Feb 2027"
    },
    {
      "name": "Founders Academy",
      "issuer": "ALX Africa",
      "dates": "Issued Jul 2024",
      "url": "https://intranet.alxswe.com/certificates/eXC3Nyc9TR"
    },
    {
      "name": "CCNA: Introduction to Networks",
      "issuer": "Cisco",
      "dates": "Issued Nov 2021"
    }
  ],
  "education": [
    {
      "degree": "Bachelor of Science in Information Systems",
      "institution": "Hawassa University",
      "dates": "Jan 2018 - Dec 2022",
      "details": "GPA: 3.57"
    }
  ]
}
